,title,author,time_,text,tags
0,Вместе с новым патчем в Elden Ring появилась трассировка лучей,Лина Скорич,23 марта ,"Команда FromSoftware обещала добавить трассировку лучей в Elden Ring после релиза, однако этот момент всё никак не наступал. Ближе к концу 2022-го датамайнеры начали находить намёки на скорое внедрение технологии. В итоге рейтрейсинг появился в игре с патчем 1.09, который вышел 23 марта. Теперь трассировка лучей доступна на ПК, PlayStation 5 и Xbox Series X. Разработчики предупреждают, что включение рейтрейсинга может повлиять на производительность Elden Ring. Минимальные: Рекомендованные: Датамайнер и большой поклонник работ FromSoftware Лэнс Макдональд (Lance McDonald) уже опробовал обновление. По его словам, разница в картинке минимальна, однако производительность на его GeForce RTX 2070 Super заметно просела. Также он отметил, что внедрено затенение, а отражения от рейтрейсинга не работают. Отсутствует и поддержка DLSS, чтобы снизить нагрузку на графический процессор. Но на этом изменения не заканчиваются. Команда внесла правки в баланс, обновила Пепел войны, а также продолжает борьбу с багами. Ниже собрали главное из патчноута: Напомним, в феврале FromSoftware анонсировала дополнение Shadow of the Erdtree (или же «Тень Древа Эрд») для Elden Ring. Больше деталей о нём обещают рассказать в будущем. DLC выпустят на ПК, PlayStation и Xbox, но пока без даты релиза.","PC, PlayStation 5, PlayStation 4, Xbox Series X | S, Xbox One"
1,С соавтора «Рика и Морти» Джастина Ройланда сняли обвинения в домашнем насилии,Лина Скорич,23 марта ,"Представительница окружной прокуратуры округа Ориндж сообщила, что суд отклонил все обвинения против Джастина Ройланда (Justin Roiland), одного из авторов «Рика и Морти» и бывшего главы студии Squanch Games. Это было сделано в силу отсутствия весомых доказательств. После закрытия дела Ройланд прокомментировал решение прокурора следующими словами: Джастин Ройланд Напомним, бывшая девушка Ройланда подала на того в суд, обвинив в совершении домашнего насилия и незаконном лишении свободы. Произошло это ещё в 2020 году, однако информация о процессе всплыла лишь в январе 2023-го. Вскоре после этого от сотрудничества с творцом отказались Hulu («Обратная сторона Земли») и телеблок Adult Swim («Рик и Морти»), а студия Squanch Games, которую он возглавлял, объявила об увольнении Ройланда. Как пишет Variety, Hulu и Adult Swim отказались комментировать решение суда.",Индустрия
2,"Для ПК-версии The Witcher 3 вышел хотфикс, повышающий стабильность",Лина Скорич,23 марта ,"Хотфикс для «Ведьмак 3: Дикая Охота» уже доступен на ПК. Он улучшает стабильность работы игры, связанную с DLSS 3, на видеокартах GeForce RTX 40-й серии. Версия игры не изменится. pic.twitter.com/JtZBSfj5wl CD Projekt RED сообщила, что выпустила очередной хотфикс для третьего «Ведьмака» на ПК. Изменений в нём кот наплакал, поэтому номер версии останется прежним. Основная задача мини-обновления — улучшить стабильность игры при использовании DLSS 3 на видеокартах GeForce RTX 40-й серии. Судя по отзывам геймеров в комментариях под постом, обновлённая The Witcher 3 всё ещё страдает от разного рода неполадок. Не исключено, что в будущем CDPR соберёт больше исправлений в полноценный патч.",PC
3,Новым бойцом League of Legends стал юный добряк Милио,Лина Скорич,23 марта ,"Трейлер на русском языке. В патче 13.6 для League of Legends добавили нового персонажа поддержки — мальчугана по имени Милио. На поле боя он усиливает союзников и по мере необходимости лечит их. Riot Games выпустила трейлер с демонстрацией парнишки в деле. Согласно предыстории Милио, мальчик довольно рано овладел аксиомой огня. Ему открылось неожиданное свойство чар — ласковое и целебное пламя. Это нашло отражение в его способностях: Ролик на английском языке. Также в патче изменили стрелков и драконов, чтобы решить проблемы ранней стадии матча на нижней линии, перебалансили некоторых героев, добавили новые товары в мифический магазин и так далее. Riot напомнила, что скоро в League of Legends прекратится поддержка 32-битных версий Windows.",PC
4,Betrayal at Club Low взяла главную награду на IGF Awards,Руслан Присекин,23 марта ,"Стали известны победители 25-й ежегодной премии Independent Games Festival Awards, чествующей лучшие инди-игры 2022-го. Betrayal at Club Low оказалась второй игрой в истории IGF Awards, которая получила сразу главный приз и награду Nuovo. Первой была Cart Life в 2013-м. Что такое Betrayal at Club Low? Это сюрреалистичная RPG без боёв, где успех в диалогах зависит от броска кубиков. В качестве агента под прикрытием вы проникаете в ночной клуб, который когда-то был фабрикой по производству гробов. Ваша задача — вытащить оттуда коллегу, пока его не раскрыли. Напомним, Betrayal at Club Low — лидер по числу номинаций наравне с Tunic. Однако Tunic не досталось ни одной награды. Жюри выбирало триумфаторов во всех категориях, не считая одной — любимчика публики определили путём народного голосования. Видео посвящено победителям этого года. Другие номинанты: Почётные упоминания: Tinykin, Terra Nil, RPG Time: The Legend of Wright, Roadwarden, Hardspace: Shipbreaker, Citizen Sleeper. Другие номинанты: Почётные упоминания: Betrayal at Club Low, Cult of the Lamb, IMMORTALITY, Melatonin, Neon White, Tinykin. Другие номинанты: Почётные упоминания: Citizen Sleeper, Cursed to Golf, Potion Craft: Alchemist Simulator, Swordship, Terra Nil, Tinykin. Другие номинанты: Почётные упоминания: Eternal Threads, Queer Man Peering Into a Rock Pool.jpg, Roadwarden, The Case of the Golden Idol, The Excavation of Hob’s Barrow, The Wreck. Другие номинанты: Почётные упоминания: I Was a Teenage Exocolonist, Melatonin, NAIAD, Potion Craft: Alchemist Simulator, Return to Monkey Island, Swordship, Terra Nil, Voodoo Detective. Другие номинанты: Почётные упоминания: A Mallard’s Song, Error143, Paper Planet, The Longest Walk, zenosyne. Другие номинанты: Почётные упоминания: Atuel, Ib, Not For Broadcast, Of Moons and Mania, RPG Time: The Legend of Wright. Другие номинанты — все перечисленные игры, кроме почётных упоминаний.",Индустрия
5,Elden Ring — игра года по версии GDC Awards,Андрей Маковеев,23 марта ,"На конференции GDC 2023 объявили лауреатов премии Game Developers Choice Awards. Победителей, как обычно, определили разработчики игр. Триумфатором стала Elden Ring — соулслайк оказался лидером в трёх категориях, включая «Игру года». Ближайший конкурент — экшен God of War: Ragnarök, тоже получивший три приза. Лучший звук Лучший дебют Лучший дизайн Награда за инновации Лучший сюжет Награда за социальную значимость Лучшая технология Лучший визуальный стиль Игра года Приз зрительских симпатий Награда для первопроходца Награда за прижизненные достижения",Индустрия
6,Началась открытая «бета» Battle Teams 2. Разыгрываем коды для игрового набора!,Руслан Присекин,24 марта ,"Издательство Astrum Entertainment и студия Wizard Games объявили о начале открытого бета-теста Battle Teams 2. Бесплатный командный шутер доступен в России и других странах СНГ на площадке VK Play. На старте ОБТ представлено 13 карт, 6 персонажей, десятки моделей оружия и множество вариантов его кастомизации. Игроки уже могут опробовать королевскую битву «Нажива», а также режимы «Командный бой», «Подрыв», «Уничтожение», «Близкие контакты» и «Битва снайперов». Вместе с запуском тестирования начался первый рейтинговый сезон «Путь к славе». Он предусматривает награды не только за продвижение по рангам, но и в дополнительной сезонной активности. Battle Teams 2 полностью переведена на русский язык. Уже играете в Battle Teams 2 или хотите начать? В любом случае вам может пригодиться набор «Ультима» — мы как раз разыгрываем несколько! Вам нужно лишь написать в комментариях к этой новости, почему вы хотите поиграть в Battle Teams 2. 20 авторов самых креативных или душераздирающих историй получат заветный ключ для активации набора. Активировать код можно до 1 апреля на официальном сайте Battle Teams 2. С января по март 2023-го прошло несколько этапов закрытой «беты» Battle Teams 2. С помощью них авторы проверяли технические аспекты, готовность серверов и локализацию, а также изучали интерес игроков к разным режимам. С тех пор Wizard Games улучшила оптимизацию игры и расширила настройки графики, что позволяет запустить боевик на большинстве ПК. Девелоперы продолжат собирать отзывы игроков и в рамках ОБТ, чтобы улучшать игру дальше. Не обойдётся и без нового контента — например, в будущем появятся сюжетные PvE-миссии. * Партнёрский материал",PC
7,В EGS дарят графонистые шахматы Chess Ultra,Руслан Присекин,23 марта ,"Наконец в Epic Games Store раздают по-настоящему серьёзную игру! И это даже не шутка, ведь речь идёт о шахматах — пусть и в обличье Chess Ultra, которую можно бесплатно забрать до 30 марта, 18:00 МСК. Chess Ultra — это самые обычные шахматы, разве что с преимуществами виртуального мира. Например, здесь есть недурственная графика, онлайн-мультиплеер и умные компьютерные соперники. А максимально приблизить игру к реальности поможет полная поддержка VR. Оценки: 83/100 на OpenCritic и 76 % положительных обзоров в Steam. Через неделю, 30 марта, в EGS начнётся раздача Tunche — фантастического 2D-экшена с элементами рогалика и очаровательной картинкой.",PC
8,The Lord of the Rings: Gollum выйдет 25 мая. Смотрите сюжетный трейлер,Андрей Маковеев,23 марта ,"Компании Nacon и Daedalic Entertainment назвали дату релиза The Lord of the Rings: Gollum — 25 мая. В этот день прибудут версии для ПК (Steam, EGS), PlayStation и Xbox. Запуск на Switch состоится до конца года. Напомним, Gollum — приквел романа «Братство кольца». Помимо всего прочего, нам расскажут о рабстве Смеагола в Чёрной башне и о его жизни с эльфами в Лихолесье. Игра представляет собой классическое сюжетное приключение. Никакого открытого мира — только линейные уровни, где Голлуму нужно прятаться от врагов. Пространство для манёвра всё же имеется — обходить противников можно разными способами. В ключевых эпизодах вам позволят принимать решения, которые подтолкнут протагониста к одной из его личностей — к мягкому Смеаголу или коварному Голлуму. Кардинально изменить повествование и повлиять на историю Средиземья, впрочем, не удастся. The Lord of the Rings: Gollum получит текстовый русский перевод.","PC, PlayStation 5, PlayStation 4, Xbox Series X | S, Xbox One, Nintendo Switch"
9,Paramount готовит мрачный экшен об одинокой черепашке-ниндзя,Андрей Маковеев,23 марта ,"В разработке находится игра по мотивам графического романа Teenage Mutant Ninja Turtles: The Last Ronin (2020). Новостью поделился сайт Polygon. Что пишут о проекте: Действие романа The Last Ronin происходит в
футуристическом Нью-Йорке. Воины клана Ноги убили Сплинтера и всех
черепашек, кроме одной. Та надевает чёрную маску, берёт оружие павших товарищей и отправляется мстить. Личность выжившего до поры до времени хранится в тайне. Это Микеланджело.",Индустрия
10,Sony — лучший издатель 2022-го по версии Metacritic,Руслан Присекин,23 марта ,"Агрегатор рецензий Metacritic уже 13 лет подряд публикует топы издателей. Если в 2021-м на троне восседала Microsoft (точнее, Xbox Game Studios), то в 2022-м её место занял прямой конкурент — Sony. Что же до «майков», то они в список не попали вовсе, поскольку издали в прошлом году всего четыре игры — на одну меньше, чем нужно. К слову, вот правила: Напомним, при составлении рейтинга продажи и пользовательские оценки значения не имеют. Metacritic берёт в расчёт только оценки от прессы, прогоняет их через специальную формулу и переводит в очки. В формуле учитываются четыре фактора: Первый фактор считается чуть важнее остальных. Как отмечает Metacritic, в 2022-м Sony выпускала только порты и продолжения — ни одной новой франшизы! Однако даже худшая игра компании за отчётный период, MLB The Show 22, получила солидные 77 баллов.",Индустрия
11,The Lords of the Fallen потеряла артикль The в названии,Александр Кудрявцев,23 марта ,"Издательство CI Games и разработчики из Hexworks решили по-тихому устранить путаницу между первой Lords of the Fallen и перезапуском The Lords of the Fallen. Они просто сократили название сиквела, превратив его в наименование оригинальной игры. А первую часть переименовали в Lords of the Fallen 2014. Судя по всему, так должно стать понятнее. Официальных заявлений по поводу смены названия девелоперы не сделали. Вторая часть серии должна стать мягким перезапуском, а события игры развернутся спустя более тысячи лет после финала Lords of the Fallen 2014. Похожий грамматический манёвр предприняли в Bloober Team. Свой следующий хоррор Layers of Fear 2023-го разработчики изначально назвали Layers of Fears, но потом убрали лишнюю букву. Lords of the Fallen выйдет на ПК (Steam), PlayStation 5 и Xbox Series в конце 2023 года.","PC, PlayStation 5, Xbox Series X | S"
12,28 марта в Apex Legends начнётся событие с убийственным солнцем,Руслан Присекин,23 марта ,"Только на днях закончилось одно коллекционное событие в Apex Legends, как на горизонте появилось другое. Ивент «Отряд солнца» пройдёт с 28 марта по 11 апреля и предложит новый временный режим. Этот режим называется «Тепловая волна». В нём действуют обычные правила для игры втроём, но во время матча периодически появляются тепловые волны, которые наносят урон. Чтобы не получить его, нужно прятаться в помещениях или под объектами, а снаружи — скользить для охлаждения. В частности, от солнца защищают увеличенные тепловые щиты. Однако они быстро разрушаются за пределами кольца. Кроме того, можно будет открыть 24 свежих косметических предмета, включая легендарные облики для Эш, Миража и Фьюза. После разблокирования всех этих предметов вам достанется «Самое сильное звено» — новая реликвия Эш.","PC, PlayStation 5, PlayStation 4, Xbox Series X | S, Xbox One, Nintendo Switch"
13,Новый геймплей и превью The Lord of the Rings: Gollum,Александр Кудрявцев,24 марта ,"После анонса даты релиза разработчики The Lord of the Rings: Gollum провели трансляцию, где показали геймплей игры и поделились некоторыми деталями. Также несколько изданий уже опубликовали превью экшена. О чём рассказали разработчики Что рассказали журналисты в превью Релиз The Lord of the Rings: Gollum назначен на 25 мая. Игра будет доступна на ПК (Steam, EGS), PlayStation и Xbox. Версия для Nintendo Switch появится позже.","PC, PlayStation 5, PlayStation 4, Xbox Series X | S, Xbox One, Nintendo Switch"
14,Девять минут перестрелок в геймплее Remnant II,Александр Кудрявцев,24 марта ,"Запись сделана в преальфа-версии игры. Ещё одно видео с геймплеем Remnant II разработчики посвятили демонстрации боевых возможностей трёх классов: стрелка, хендлера и челленджера. Последний представлен впервые. Все фрагменты записаны во время прохождения биома Yaesha. Для каждого забега игра генерирует локации, квесты и противников. Так разработчики хотят подарить каждому игроку уникальный опыт. Из ролика выше можно почерпнуть, что хендлер для ближнего боя пользуется кастетами. Также персонаж с этим архетипом сможет запускать во врагов снаряды из подствольного гранатомёта. Пёс умеет выполнять не только боевые команды — он также любит, когда его просто чешут за ухом. Челленджер вооружён дробовиком и большим двуручным мечом. Разработчики ещё не рассказывали о навыках этого архетипа. Но в ролике показано, как он отбрасывает врагов звуковой волной. Remnant II должна выйти летом 2023 года на ПК (Steam, Epic Games Store), PlayStation 5 и Xbox Series. Заявлена поддержка русского языка.","PC, PlayStation 5, Xbox Series X | S"
