,title,author,time_,text,tags
359,Мальчик играет со спичками в геймплейном видео Bramble: The Mountain King,Александр Кудрявцев,19 апреля ,"Студия Dimfrost представила первые 15 минут геймплея адвенчуры Bramble: The Mountain King с комментариями ведущего художника проекта. Ролик начинается с пробуждения мальчика Олле — главного героя игры. Ему приснился кошмар после того, как мама рассказала им с сестрой страшную сказку на ночь. Не найдя свою сестру дома, мальчик бежит за ней в лес. На видео показано, как Олле взаимодействует с предметами. Коробок спичек можно вертеть и рассматривать с разных сторон, при этом физика продолжает работать — например, из коробка вываливаются все спички. Позже эта механика пригодится для решения головоломки. Действия протагониста и его мысли комментирует рассказчик с женским голосом, будто мальчик сам является героем страшной сказки на ночь. Bramble: The Mountain King выйдет 27 апреля на ПК (Steam, Epic Games Store), PlayStation, Xbox и Nintendo Switch.","PC, PlayStation 5, PlayStation 4, Xbox Series X | S, Xbox One, Nintendo Switch"
360,Шутер с видом из нагрудного регистратора получил название Unrecord,Александр Кудрявцев,20 апреля ,"Французский инди-девелопер Александр Спиндлер (Alexandre Spindler) смог найти единомышленников и создать собственную студию DRAMA для разработки шутера от первого лица Unrecord. В октябре 2022-го в Сети завирусился ролик о шутере с очень реалистичной картинкой. Теперь создатель собрал небольшую команду и выпустил геймплейный трейлер игры. Unrecord позволит побыть в роли полицейского, который расследует сложные дела и нередко участвует в перестрелках. Разработчики выделяют сюжет как одну из ключевых особенностей проекта. Игрокам обещают кинематографичный триллер с неожиданными поворотами истории. Unrecord пока находится на раннем этапе разработки. Студия всё ещё ищет финансирование, поэтому релиза игры не стоит ожидать в этом году. Шутер будет доступен на ПК через Steam. Поддержка русского языка не заявлена.",PC
361,Square Enix начнёт продвижение блокчейна среди традиционных геймеров ,Александр Кудрявцев,20 апреля ,"Компания Square Enix объявила о заключении стратегического партнёрства с платформой Elixir Games, которая занимается распространением игр с технологией блокчейн и web3. Издатель и раньше финансировал деятельность площадки, но новое соглашение должно вывести сотрудничество на новый уровень. Square Enix хочет повысить узнаваемость web3-игр для ПК и их востребованность среди традиционных геймеров. Начать массовое внедрение технологий планируется уже в 2023 году. Ранее Square Enix заявляла, что планирует начать разработку собственных игр с NFT и блокчейном.",Индустрия
362,Valve разрабатывает новый VR-шлем ,Александр Кудрявцев,20 апреля ,"Продакт-дизайнер Valve Грег Кумер (Greg Coomer) во время интервью подтвердил, что компания работает над созданием новой гарнитуры виртуальной реальности. Разработчик беседовал с сотрудниками корейского сайта This Is Game. Грег подтвердил, что работа ведётся, но отказался раскрывать какие-либо подробности. По его словам, компания продолжит развивать VR-напарвление. Автор портала Game Rant считает, что компания после успеха Steam Deck будет двигаться в сторону уменьшения стоимости VR-устройств для потребителя. Сейчас покупка полного набора Valve Index обходится в тысячу долларов. Портативная консоль компании при этом продавалась дешевле конкурентов и стала популярной.",VR
363,Epic Games купила авторов Horizon Chase Turbo — они будут работать над Fortnite,Лина Скорич,20 апреля ,"Join us in welcoming AQUIRIS to Epic. @AquirisGS will become Epic Games Brasil and the team will create groundbreaking content and social experiences within Fortnite. Bem-vindo!https://t.co/tytLjHr6QQ «Давайте вместе поприветствуем AQUIRIS в Epic. Студия получит новое название Epic Games Brasil и будет создавать революционный контент и социальные возможности для Fortnite. Bem-vindo! (добро пожаловать)». Epic Games приобрела ещё одну студию для своей коллекции. На этот раз под крыло компании попадёт бразильская команда AQUIRIS, которая известна благодаря гоночной аркаде Horizon Chase Turbo и приключению Wonderbox. Epic Games заприметила AQUIRIS ещё в начале 2022 года и тогда же проинвестировала в неё свои средства. Бразильский коллектив станет основой для Epic Games Brasil — первой студии «эпиков» в Латинской Америке. Силы подразделения бросят на создание контента для Fortnite. Морисио Лонгони (Mauricio Longoni), глава AQUIRIS Бразильскую студию основали в 2007 году. Благодаря ней свет увидели мобильные Wonderbox: The Adventure Maker и Looney Tunes World of Mayhem, а также гоночные игры из серии Horizon Chase.",Индустрия
364,Слух: Ubisoft отменила неанонсированный «батл-рояль» по Splinter Cell,Лина Скорич,20 апреля ,"Похоже, на кладбище Ubisoft недавно появилось свежее захоронение, и имя ему — Splinter Cell: Hunters. Если верить пользователю, который назвал себя плейтестером упомянутого проекта, компания отменила королевскую битву за несколько недель до анонса. По сведениям игрока, Splinter Cell: Hunters представляла собой королевскую битву в формате PvPvE от третьего лица. В ней были различные оперативники, настраиваемые классы и ночная карта. Парам геймеров предлагалось находить и ликвидировать важные цели, разбросанные по всей локации, а также сражаться с другими пользователями и ИИ-противниками. Когда один из дуэтов первым добирался до цели, он получал возможность обчистить тайники, а затем покинуть локацию. Что происходит с оставшимися в игре оперативниками, автор не сообщил. Всего карты «Охотников» вмещали до тридцати человек. Среди прочих особенностей Splinter Cell: Hunters значились: Ранее Ubisoft прочесала свои проекты, которые находятся в производстве, и отменила сразу несколько из них. В качестве причины компания указала «изменившуюся финансовую ситуацию». Тем временем с ремейком первой Splinter Cell творится что-то непонятное. Том Хендерсон (Tom Henderson) сообщал, что команду проекта направили помогать с разработкой следующей Far Cry.",Индустрия
365,Голос Питера Паркера завершил работу над Marvel's Spider-Man 2,Андрей Маковеев,20 апреля ,"Новостей о Marvel’s Spider-Man 2 всё ещё мало, но игра уверенно движется к релизу. В частности, актёр Юрий Ловенталь (Yuri Lowenthal), исполняющий роль Питера Паркера, заявил, что он уже закончил запись своих реплик. Эту деталь актёр раскрыл отвечая на вопросы пользователей Reddit. Ловенталь добавил, что сеансы захвата движений для сиквела также завершены. Никакими другими сведениями артист не поделился. Напомним, во второй части компанию Паркеру составит Майлз Моралес, которого вновь сыграл Наджи Джитер (Nadji Jeter). Среди злодеев точно появится Веном — его озвучил Тони Тодд (Tony Todd; Кэндимен из одноимённых фильмов). Marvel’s Spider-Man 2 стартует на PlayStation 5 ближайшей осенью. Если верить Тони Тодду, выход назначен на сентябрь.",PlayStation 5
366,Вместе с патчем в Returnal добавили поддержку FSR 2.0,Лина Скорич,20 апреля ,"Накануне Housemarque и Climax Studios выпустили ещё один патч для научно-фантастического рогалика Returnal. Апдейт содержит ряд улучшений, среди которых поддержка технологии AMD FSR 2.0, а также возможность перестроить данные кэша PSO вручную. Внедрение AMD FidelityFX Super Resolution 2.0 позволит улучшить картинку, не ударив при этом по фреймрейту. А перестраивание кэша поможет оптимизировать производительность, убрать «заикания» и не только. Пошаманить над кэшем можно в настройках графики. Помимо упомянутых фич, обновление включает в себя следующее: Напомним, изначально Returnal приземлилась на PlayStation 5 в апреле 2021-го, а на ПК оказалась в феврале 2023-го. Критики и рядовые пользователи высоко оценили порт. Например, на момент написания заметки рейтинг игры в Steam составляет 81 % положительных отзывов.",PC
367,К списку героев в Darkest Dungeon II присоединится Самобичеватель,Лина Скорич,20 апреля ,"Самобичеватель появился в оригинальной Darkest Dungeon вместе с дополнением The Crimson Court. Однако во второй части персонаж уже войдёт в перечень героев, доступных с самого начала. Разработчики из Red Hook Studios подробнее рассказали о двенадцатом бойце из Darkest Dungeon II. Первое, что бросается в глаза, — это изменившийся облик персонажа. Кажется, Самобичеватель времени зря не терял и не прекращал свою болезненную практику — теперь он похож не на человека, а на ходячий труп. По словам девелоперов, Самобичаватель балансирует между жизнью и смертью благодаря исключительной силе воли. Сотрудники Red Hook Studios В сиквеле Самобичеватель получил новые приёмы, но его суть осталась прежней — необходимо держать персонажа на грани гибели, чтобы повысить его эффективность. Боец может потратить очки здоровья для усиления своих атак, а также впитать урон, чтобы побыстрее войти в предсмертное состояние. Своими ударами Самобичеватель отравляет врагов, а также он в силах вызвать ядовитый дождь. Поддерживающие умения тоже имеются: герой умеет восстанавливать здоровье товарищей за счёт собственного, накидывать усиления, а также он забирает себе негативные статусы напарников. Кроме того, в Darkest Dungeon II введут мини-босса, непосредственно связанного с Самобичевателем. Так как персонаж слишком часто избегал гибели, за его головой отправилась сама Смерть. Шанс встретиться с костлявой появляется после каждой победы группы, в составе которой есть Самобичеватель. Смерть обладает специальным набором навыков, которые обходят сопротивление Самобичевателя фатальным ударам. Бой с ней представляет серьёзную угрозу для любой экспедиции, уверяет команда. За победу над старухой с косой полагается особый предмет — цветок мёртвой головы. Кроме того, для Самобичевателя заготовлена собственная история, изучить которую получится с 8 мая, — в этот день Darkest Dungeon II выйдет из раннего доступа. Релиз состоится на ПК через Steam и Epic Games Store. Заявлена поддержка русского языка.",PC
368,"Для ПК-версии Cyberpunk 2077 вышел хотфикс, который призван устранить вылеты",Лина Скорич,20 апреля ,"На ПК вышел хотфикс для Cyberpunk 2077. Он исправляет две ошибки, когда игра вылетала, в том числе во время финального квеста. Настройка динамического разрешения теперь выключена, если включена трассировка путиВерсия игры не изменится, но хотфикс может повлиять на работу модов pic.twitter.com/0DKNSf3Cif На прошлой неделе Cyberpunk 2077 на ПК получила большой патч, вместе с которым в игру внедрили дополнительный режим «Трассировка лучей: перегрузка». Похоже, вместе с добавкой в ролевой экшен пробрались и новые ошибки. Свежий хотфикс нацелен их ликвидировать. По словам разработчиков, заплатка исправляет две неполадки, из-за которых игра могла вылетать. Кроме того, теперь настройка динамического разрешения будет выключена, если активирована трассировка пути. Версия игры останется прежней, но CD Projekt RED предупреждает, что после установки патча могут барахлить некоторые моды. В 2023 году Cyberpunk 2077 получит сюжетное расширение Phantom Liberty. Оно разблокирует ранее недоступный район Найт-Сити, а также познакомит с персонажем, которого сыграл Идрис Эльба (Idris Elba). Свежие подробности о DLC должны появиться в июне.",PC
369,Deathloop планировалась как маленькая игра перед потенциальной Dishonored 3,Руслан Присекин,20 апреля ,"Deathloop по масштабу не уступает предыдущим творениям Arkane Studios. Однако задумывалась она как небольшой проект, который должен был подготовить девелоперов к работе над следующей AAA-игрой. Об этом в разговоре с Rock Paper Shotgun рассказал Рафаэль Колантонио (Raphaël Colantonio), основатель Arkane. После слабых продаж Dishonored 2 и Dishonored: Death of the Outsider владельцы студии из Bethesda засомневалось в светлом будущем серии и предложили разработчикам заняться маленьким и экспериментальным проектом перед тем, как взяться за что-то серьёзное. Рафаэль Колантонио Примерно в то время Prey (2017) получила roguelite-дополнение Mooncrash. То есть Arkane уже тогда интересовалась этим жанром, к тому же он был популярен среди игроков и девелоперов.
В итоге студия решила развить его идеи в следующей игре, которой и оказалась Deathloop. Правда, к концу разработки Deathloop назвать маленькой игрой язык не поворачивался. «Скорее всего, создание Dishonored 3 стоило бы столько же. Изначально это не планировалось», — сказал Колантонио. К моменту выхода Deathloop Колантонио уже не работал в Arkane — он продолжил творческий путь работой над Weird West в собственной студии WolfEye. Тем не менее, Arkane не забыла про Dishonored — Динга Бакаба (Dinga Bakaba), руководитель подразделения в Лионе, не так давно подтвердил, что события Deathloop и Dishonored происходят в одной вселенной.",Индустрия
370,Шоу THQ Nordic пройдёт 11 августа — там покажут Alone in the Dark и Trine 5,Руслан Присекин,20 апреля ,"Издательство THQ Nordic анонсировало третью презентацию своих игр — она начнётся 11 августа в 22:00 МСК. На THQ Nordic Digital Showcase анонсируют игры и поделятся новостями об уже анонсированных, включая новую Alone in the Dark, Outcast 2: A New Beginning, Trine 5: A Clockwork Conspiracy, Jagged Alliance 3, Stuntfest и ремейк Gothic. Кроме того, будет прешоу с проектами от HandyGames. Трансляция пройдет на YouTube, Twitch и в Steam.",Индустрия
371,В EGS дарят подводное приключение Beyond Blue и ледяной платформер Never Alone,Руслан Присекин,20 апреля ,"До 27 апреля, 18:00 МСК, в Epic Games Store можно бесплатно забрать две познавательные игры — Beyond Blue и Never Alone (Kisima Ingitchuna). Beyond Blue — подводное приключение, которое создавалось вместе с океанологами и авторами документального сериала «Голубая планета II». Оценки: «Похвально» на StopGame, 72/100 на OpenCritic, 87 % положительных обзоров в Steam. Never Alone (Kisima Ingitchuna) — фольклорный платформер, разработанный в сотрудничестве с инуитами, коренным народом Аляски. Главные герои — девочка Нуна и её песец. Они пытаются найти источник непрекращающейся метели, которая может разрушить весь известный им мир. Играть можно как одному, так и вдвоём в локальном кооперативе. Оценки: «Похвально» от StopGame, 72/100 на OpenCritic, 81 % в Steam. Через неделю, 27 апреля, в EGS начнётся раздача юмористического выживача в космосе Breathedge и покерного симулятора Poker Club.",PC
372,Волшебные системные требования Immortals of Aveum,Руслан Присекин,20 апреля ,"Новый геймплейный трейлер. Магический экшен Immortals of Aveum использует передовые технологии Unreal Engine 5.1. За всё нужно платить — в данном случае системными требованиями, которые могут неприятно удивить даже обладателей мощного железа. Immortals of Aveum выйдет 20 июля на ПК (Steam, Epic Games Store, EA app), PlayStation 5 и Xbox Series. Русского языка не будет.","PC, PlayStation 5, Xbox Series X | S"
