,title,author,time_,text,tags
129,Дин Холл скрещивает Barotrauma и RimWorld в своей новой игре ,Александр Кудрявцев,1 апреля ,"Создатель легендарной DayZ Дин Холл (Dean Hall) показал журналистам свою следующую игру Torpedia, которую сейчас разрабатывает его студия RocketWerkz. Разработчик сам описывает свой проект как RimWorld, где нужно управлять не колонистами на неизвестной планете, а экипажем подводной лодки. Своё судно можно и нужно постоянно перестраивать и улучшать. Прогресс может дойти даже до атомных реакторов на борту. Но начинает игрок с деревянным «корытом» с печью, в которую нужно постоянно докидывать дрова, чтобы поддерживать необходимы уровень энергии. Автор портала PC Gamer смог поиграть в прототип Torpedia. Игра прежде всего позволяет пережить собственные истории выживания во враждебной среде, как это делает, например, Barotrauma. В Torpedia тоже нужно исследовать глубины, искать ресурсы и грабить затонувшие корабли. Во время одной из вылазок водолаз из команды журналиста умер от того, что его придавило ко дну подводной лодкой, которая дрейфовала без присмотра. Получив предупреждение о холодном шторме, автор не придал ему значение. В итоге его лодка замёрзла во льдах без возможности двигаться. Пока журналист ждал потепления, энергия кончилась и экипаж умер. Также в Torpedia есть порт, где игрок может нанимать себе команду и улучшать подлодку. Набрать на борт можно самых разношёрстных исследователей глубин. Например, любимчиком автора PC Gamer стал человек-акула. У каждого есть своя личность, сильные и слабые стороны, которые могут привести к неожиданным последствиям во время плавания. Torpedia ещё полноценно не анонсирована. Дата релиза неизвестна.",PC
130,В Resident Evil 4 Remake нашли критическую ошибку,Александр Кудрявцев,1 апреля ,"⚠️ Resident Evil 4 players ⚠️Please be aware of a rare but critical progress bug. This issue will only occur under very specific circumstances, as detailed below. We're working on a fix and apologize for any inconvenience. pic.twitter.com/rcJaFXE1jG В официальном твиттере Resident Evil появилось предупреждение о критической ошибке в ремейке «четвёрки», которая может произойти в 12 главе и заблокировать прохождение. Девелоперы вычислили, что баг происходит при определённых действиях. Если их не проводить, то всё будет в порядке. Проблемное место — начало 12 главы. После кат-сцены игрок получает предмет, которые будет необходим для дальнейшего прохождения. Нельзя нажимать кнопку удара ножом, пока в правом верхнем углу не появится уведомление об успешном получении предмета. А лучше даже проверить инвентарь — новый предмет должен появиться в том же разделе, где хранятся сокровища. Если всё-таки вам не посчастливилось встретить подобную ошибку, то единственный способ продолжить прохождение — загрузить сохранение до 12 главы. Разработчики обещают в скорейшее время исправить этот баг. ","PC, PlayStation 5, PlayStation 4, Xbox Series X | S"
131,Анонс ARK: Survival Ascended — ремастера Survival Evolved. ARK 2 снова перенесли,Лина Скорич,1 апреля ,"Studio Wildcard опубликовала внушительную запись на официальном сайте серии ARK. В ней команда представила ARK: Survival Ascended, ремастер ARK: Survival Evolved для ПК и некстген-консолей, а также сообщила об очередном переносе ARK 2 — теперь до 2024 года. ARK 2 Девелоперы признались, что столкнулись с трудностями при работе с Unreal Engine 5, поэтому решили отложить старт ARK 2. По этой же причине в 2023 году команда не планирует показывать скриншоты или видео из сиквела. Из обращения девелоперов Теперь ARK 2 намерены выпустить ближе к концу 2024-го на ПК (Steam) и Xbox Series, включая Game Pass. ARK: Survival Ascended Если верить Studio Wildcard, в процессе осваивания UE5 чему-то её специалисты уже успели научиться. Эти знания помогут освежить ARK: Survival Evolved — для неё готовится ремастер под названием ARK: Survival Ascended. Команда осознаёт, что не всем придутся по нраву нововведения в сиквеле. Поэтому девелоперы хотят создать по-настоящему некстгенную версию оригинальной игры, чтобы пользователи могли наслаждаться ею на протяжении долгих лет. Заодно это позволит команде набить руку и протестировать особенности движка. Ниже собрали главное о проекте: Помимо прочего, студия пообещала перевыпустить ARK: Mobile с улучшенной графикой, которая основана на версии проекта для Switch. Тем временем производство анимационного сериала по ARK в полном разгаре: уже нарисованы и озвучены 14 стартовых эпизодов. В данный момент специалисты трудятся над визуальными эффектами и звуковым сопровождением.","PC, PlayStation 5, Xbox Series X | S"
132,Тираж Sifu в Steam превысил 50 000 копий за четыре дня,Лина Скорич,1 апреля ,"Past 4 days:- Sifu's subreddit reached 20k users- Sifu sold 50k units on Steam- 94% Positive Review rating on Steam!And a propos of nothing, if you enjoyed the Arenas and got 5 minutes to spare, feel free to drop a positive review on Steam. Please? :) pic.twitter.com/Ft1S5nIowz Также за минувшие дни сабреддит игры разросся до 20 000 участников. Кунг-фу боевик Sifu доступен на ПК через Epic Games Store уже больше года. Однако некоторые предпочли сохранить верность магазину Valve и ждали релиза именно в Steam. По данным команды Sloclap, за четыре дня в Steam Sifu разошлась тиражом в 50 000 копий. На момент написания новости у Sifu весьма приличный рейтинг в магазине Valve — 94 % положительных отзывов на основе 845 обзоров. Разработчики хотят больше фидбека, поэтому просят фанатов оставить мнение об игре в Steam. Высоким онлайном боевик похвастаться пока не может — максимальное количество одновременных пользователей замерло на отметке в 3 189 человек. Напомним, в Sifu предстоит помочь главному герою отомстить убийцам семьи. Персонаж полагается не только на своё мастерство, но и на волшебный амулет, который возвращает к жизни после смерти. Однако при каждом использовании артефакт делает протагониста старше. Beat 'em up о боевых искусствах вышел на площадке Valve и на Xbox 28 марта. Релиз состоялся одновременно с выпуском режима арен, который добавляет в проект ещё 10 часов контента. Также Sifu доступна на PlayStation и Nintendo Switch.",PC
133,Пора кекать — лучшие (или нет) игровые шутки в честь 1 апреля,Руслан Присекин,2 апреля ,"С вами самый быстрый в мире новостной ресурс StopGame! Подводим итоги Дня дурака — мы собрали для вас отборные приколы. Наберите воздуха в грудь и готовьтесь долго смеяться (или недоумевать, что здесь смешного). Во-первых, главный первоапрельский кек — это видео Даура Авидзбы про унитазы. Вы думали, уборные добавляют в игры просто так? Вовсе нет, за каждым стульчаком скрывается своя история! Соник мёртв! Ну, почти — в честь своего дня рождения Эми Роуз устроила в поезде «Мираж-Экспресс» вечеринку, посвящённую загадочному убийству. Жертвой стал синий ёжик, а вам нужно расследовать это дело. The Murder of Sonic the Hedgehog — визуальная новелла, доступная бесплатно в Steam. Вам нужно допрашиваться знакомых персонажей, включая Тейлза и Наклза, и проходить мини-игру в жанре раннера. Увы, поддержки русского языка нет. Here's some updates:One of our next DLCs will take 6 hours to complete. Студия Mundfish заявила, что одно из дополнений для Atomic Heart потребует 6 часов на прохождение. Мало? Много? В самый раз? В любом случае это шутка. А вот сами DLC — не шутка, они действительно находятся в разработке. Недавно стало известно, что в Steam появится Dolphin — эмулятор GameCube и Wii. Появится не с пустыми руками, а с поддержкой достижений. Например, одно дадут, если заставить игру издать пищащий сигнал при сбое, а другое — если играть в течение двух часов без выбранного звукового сопровождения. Вчера в Battlefield 2042 начался кроссовер с Dead Space. Не видите? А он есть! Крис Прэтт (Chris Pratt) настолько хорошо вписался в роль Марио в грядущем фильме «Братья Супер Марио в кино», что Nintendo решила добавить его голос в игры про усатого водопроводчика. Ну, и остальных актёров до кучи. Если для вас помехой не стал даже хардкорный режим в Kingdom Come: Deliverance, то, возможно, ваш пыл сможет остудить ультрахардкорный режим (в параллельной вселенной, где он существует). Там нет сохранений ни в каком виде и нельзя пользоваться лошадьми, а после смерти игра удаляется. Ах да, играть можно только на латинском языке! Разработчики ремейка Gothic прислушались к игрокам, которые жаловались на недостаток бочек в игре. Теперь всё в ваших руках — с помощью заклинания «Бочечный дождь» можно сделать сколько угодно бочек! Wanted: Dead недаром выглядит как игра с PlayStation 2 — там её и собираются выпустить (нет)! Правда, для установки потребуется 10 DVD (тоже нет). По уже сложившейся традиции 1 апреля в Among Us добавляют режим, где персонажи превращаются в лошадей. Поиграть за животных можно до 3 апреля, 09:59 МСК, в классическом режиме и прятках. Если вам мало качественного контента выше, предлагаем проследовать на Gematsu — там заботливо собраны и другие шутки.",Фановые
134,"Опрос Famitsu: Леон — лучший персонаж Resident Evil, а RE7 — самая страшная часть",Руслан Присекин,2 апреля ,"В преддверии выхода ремейка Resident Evil 4 японское издание Famitsu провело опрос об играх серии. В результате было составлено несколько топов, в том числе с самыми страшными частями, самыми любимыми/ненавистными персонажами и самыми страшными/неожиданными моментами. Напомним, ещё больше цифр ранее опубликовали непосредственно о ремейке Resident Evil 4. Во-первых, игра разошлась тиражом более 3 миллионов копий за два дня. Во-вторых, Capcom опубликовала статистику игры.",Индустрия
135,GamesVoice представила часть актёров русской озвучки Hogwarts Legacy,Лина Скорич,3 апреля ,"Команда GamesVoice выпустила третий видеодневник русской озвучки Hogwarts Legacy, в котором частично огласила список актёров. В первую очередь были представлены специалисты, подарившие свои голоса персонажам из пролога. Если вы смотрели видео с демонстрацией геймплея Hogwarts Legacy на русском языке, то могли узнать голоса некоторых актёров. Пока список выглядит так: Протагонистов Hogwarts Legacy озвучили молодые актёры Анна Галицкая и Даниил Бледный. О них локализаторы пообещали рассказать позже. Если верить GamesVoice, на момент выхода ролика в игру записано 38 актёров и озвучено почти 10 часов итогового хронометража (около трети всей работы). Реплики всех персонажей из пролога, за исключением протагонистов, уже полностью записаны. Также команде потребуется время на обработку материала, сведение и тестирование. Напомним, коллектив планирует выпустить русскую озвучку «Наследия» в 2023 году.",PC
136,Фильм по D&D оказался неплохим — это подтверждают стартовые сборы и отзывы,Лина Скорич,3 апреля ,"31 марта в США и ряде других стран в широкий прокат отправился фильм «Подземелья и драконы: Честь среди воров». За свои первые выходные на родном рынке картина собрала 38,5 миллиона долларов и смогла обогнать лидера предыдущей недели — четвёртую часть «Джона Уика». Как пишет Variety, за рубежом экранизация добрала ещё 33 миллиона долларов, поэтому её итоговый результат за уикенд — 71,5 миллиона долларов. Адаптация культовой настолки превысила ожидания аналитиков, которые пророчили стартовые сборы между 30-ю и 40 миллионами долларов. Напомним, до начала маркетинговой кампании бюджет «Чести среди воров» составил 150 миллионов долларов, поэтому фильму нужно больше зрителей, чтобы отбить все затраты и начать зарабатывать. Если верить Дэвиду Гроссу (David A. Gross), главе консалтингового агентства Franchise Entertainment Research, кинокартина показала хороший старт. На фоне положительных отзывов проект должен окупиться и положить начало полноценной серии. Тем временем создатели киноленты Джон Фрэнсис Дейли (John Francis Daley) и Джонатан Голдштейн (Jonathan Goldstein) признались, что изначально сосредоточились лишь на одном фильме и не планировали франшизу. Джон Фрэнсис Дейли Теперь, когда лента отправилась в прокат, режиссёры задумались о продолжении. По их словам, в сиквеле может вернуться команда из первой части. Так не придётся снова тратить время на знакомство с персонажами. По мнению постановщиков, в продолжении члены группы должны развиваться. Например, бард в исполнении Криса Пайна (Chris Pine) не пользуется магией, однако в сиквеле мог бы выучить пару заклинаний. Кроме того, авторы выразили желание ввести новые локации, героев и монстров во второй части. «…Мы очень хотим продолжить рассказывать истории в этом мире. У него огромный потенциал», — сказал Дейли. На момент написания заметки у «Чести среди воров» на Metacritic 72 балла от прессы и 7,9 балла от простых пользователей. Фильм хвалят за юмор и боевые сцены. Некоторые сравнивают картину со «Стражами Галактики» Джеймса Ганна (James Gunn). Среди восторженных зрителей оказался и Хидео Кодзима (Hideo Kojima), который отметил визуальные эффекты и художественный стиль фильма. «Он меня удивил! Он был чертовски смешным!» — поделился гейм-дизайнер. Похоже, «Подземелья и драконы: Честь среди воров» продолжают череду кинолент, которые преодолели проклятье игровых адаптаций. Ранее аудитория и критики тепло встретили экранизации Sonic the Hedgehog и Uncharted. Ожидается, что анимационный фильм о братьях Марио, который стартует уже на днях, продолжит эту тенденцию.",Кино
