,title,author,time_,text,tags
248,Destroy All Humans! 2: Reprobed выйдет на пастгене 27 июня — без мультиплеера,Руслан Присекин,11 апреля ,"В августе 2022-го ремейк Destroy All Humans! 2 вышел на ПК, PlayStation 5 и Xbox Series. 27 июня очередь дойдёт до PS4 и Xbox One. Правда, обладатели консолей прошлого поколения не смогут играть в мультиплеер — только в сюжетную кампанию: На пастгене Destroy All Humans! 2: Reprobed будет стоит $30. Напомним, на PS5 и Xbox Series за игру просят $40. В прошлом году на ПК, PlayStation 4/5 и Xbox One/Series также выпустили Clone Carnage — многопользовательский спин-офф Destroy All Humans! Популярности он не снискал, поэтому его сделали бесплатным.","PlayStation 4, Xbox One"
249,"Dead Island 2: системные требования, фреймрейт на консолях и отсутствие кросс-плея",Андрей Маковеев,11 апреля ,"Dambuster Studios опубликовала системные требования Dead Island 2 и рассказала о технических особенностях игры, включая производительность на консолях. Минимальные (1080p при 30 fps) Рекомендуемые (1080p при 60 fps) Высокие (1440p при 60 fps) Ультра (4K при 60 fps) Dead Island 2 стартует 21 апреля. Заявлен текстовый перевод на русский.","PC, PlayStation 5, PlayStation 4, Xbox Series X | S, Xbox One"
250,Nintendo проведёт очное шоу в сентябре,Руслан Присекин,11 апреля ,"Announcing #NintendoLive 2023, an in-person event for fans of all ages that will take place in Seattle this September! Experience Nintendo Switch gameplay, live stage performances, tournaments, photo ops, and more.Stay tuned for more details: https://t.co/0uePw3LHqS pic.twitter.com/3nqalGUTa0 Nintendo анонсировала своё очное мероприятие — Nintendo Live 2023. Оно пройдёт в сентябре в Сиэтле. Вас ждут выступления на сцене, киберспортивные соревнования, фотосессии с персонажами компании и много другое. Будут ли анонсы — неизвестно. Подробности появятся в ближайшее время. Ранее Nintendo отказалась от участия в E3 2023, а после выставку отменили. Однако до сентября компания наверняка проведёт своё регулярное цифровое шоу Nintendo Direct — может быть, даже не одно! Среди подтверждённых летних мероприятий — Summer Game Fest (с 8 июня), Xbox Games Showcase (11 июня), PC Gaming Show (11 июня), Ubisoft Forward Live (12 июня) и gamescom (22–27 августа).",Индустрия
251,В июне отключат серверы Rogue Company для Switch,Андрей Маковеев,11 апреля ,"Rogue Company — сетевой шутер с видом от третьего лица. Пока что игра доступна на ПК (Steam, EGS), PlayStation, Xbox и Nintendo Switch, но 20 июня список платформ сократится — компания Hi-Rez Studios закроет Switch-версию. В указанный день Rogue Company для гибридной консоли окончательно прекратит работу. С сегодняшнего дня в экшене отключены микротранзакции, но играть пока можно. Перенести свой прогресс на другую платформу предлагается через привязку аккаунта. По словам разработчиков, они пришли к выводу, что порт для Switch не соответствует их стандартам качества и команда не в состоянии поддерживать его на должном уровне. Отказ от проблемной версии позволит Hi-Rez быстрее и эффективнее улучшать боевик на других устройствах. Из заявления Hi-Rez Studios",Nintendo Switch
252,Ремейк Resident Evil 4 прорубил себе дорогу на вершину британского чарта,Александр Кудрявцев,11 апреля ,"Портал GamesIndustry.biz поделился данными аналитических компаний GSD и GfK. По числу цифровых и розничных продаж в Великобритании первое место заняла Resident Evil 4 Remake, обогнав Hogwarts Legacy. Новая игра от Capcom не смогла превзойти продажи релизной недели Resident Evil 2 Remake или Resident Evil Village. Однако старт обновлённой четвёртой части прошёл лучше, чем у ремейка Resident Evil 3 в 2020 году. Аналитики также выяснили, обладатели каких платформ чаще покупали RE 4. Продажи игры распределились неравномерно: ПК — 15 %, Xbox — 20 % и  PlayStation — 65 %. Несмотря на то что RE 4 вышла совсем недавно, игра смогла обогнать фаворита месяца — Hogwarts Legacy. Игра про волшебников уже четыре недели держала лидерство в розничном чарте Великобритании. Топ-10 продаж за март 2023-го также включает Metroid Prime Remastered, хотя данные о реализации цифровых копий недоступны из-за политики Nintendo. Ещё аналитики отметили, что в первом квартале 2023-го PlayStation 5 заняла половину консольного рынка. Продажи устройства выросли на 180 % за первые три месяца года. Nintendo Switch держится на втором месте, несмотря на падение продаж на 25 %. Xbox Series в Великобритании всё ещё в меньшинстве — продажи консоли снизились на 18 % в первом квартале 2023-го.",Индустрия
253,Пошаговые бои с изюминкой в геймплейном ролике о Sea of ​​Stars,Александр Кудрявцев,11 апреля ,"Журналисты Game Informer поделились роликом о Sea of ​​Stars и своими впечатлениями от ретро-RPG. Проект готовят разработчики платформера The Messenger. Игрок возьмёт на себя управление небольшим отрядом, во главе которого стоят подростки Валери и Зейл. Вместе с друзьями они должны исследовать мир, решать проблемы местных обитателей и побеждать чудовищ. В ролике показан геймплей не из начала игры. В видео можно увидеть исследование локаций и бой с человекоподобным кротом и его ручным ящером. Журналисты похвалили местный дизайн персонажей. Противники выглядят одновременно дружелюбно и угрожающе, что создаёт особую атмосферу приключения без ненужного напряжения. Бои в Sea of ​​Stars пошаговые, но игрок не просто выбирает способности и заклинания из списка. Для некоторых ударов, например, необходимо зажать кнопку атаки и вовремя её отпустить, чтобы нанести максимальный ущерб. Такие механики вовлекают игрока в противостояние и добавляют динамики. Выход Sea of Stars состоится 29 августа на ПК (Steam), PlayStation, Xbox и Nintendo Switch. Игра получит русскую локализацию.","PC, PlayStation 5, PlayStation 4, Xbox Series X | S, Xbox One, Nintendo Switch"
254,Life by You не будет требовать постоянного подключения к Интернету ,Александр Кудрявцев,12 апреля ,"Глава Paradox Tectonic Род Хамбл (Rod Humble) продолжает делиться подробностями о своём следующем симуляторе жизни Life by You. Разработчика спросили, не собираются ли авторы игры зайти на территорию метавселенных, как это активно пытаются сделать Meta* и Epic Games. Род ответил, что хоть в игре и есть возможность создавать города, персонажей и многое другое, проект прежде всего нацелен на однопользовательский опыт. Род Хамбл Также в игре на релизе не будет возможности играть в кооперативе. Но Хамбл не исключает, что в будущем разработчики подумают, как можно реализовать совместную игру. Ещё Род снова высказался о пользовательских модификациях. Paradox Tectonic не будет заниматься модерацией модов. Игроки смогут установить себе всё, что захотят. На сайте разработчиков будет подборка творчества фанатов игры, но в Paradox Tectonic не будут против, если игрок поставит себе мод на болезни, которых в игре нет по умолчанию. Разработчики также не будут вмешиваться в деятельность создателей контента и других пользователей Сети, которые захотят заработать с помощью Life by You. Ранний доступ к симулятору жизни Life by You стартует 12 сентября на ПК (Steam, Epic Games Store). * Деятельность организации «Meta» признана экстремистской и запрещена на территории Российской Федерации",PC
255,Мастер клинка против бластера в геймплейном видео Hyper Light Breaker,Александр Кудрявцев,12 апреля ,"Разработчики Hyper Light Breaker поделились с изданием Game Informer новыми геймплейными кадрами из своей будущей игры. В ролике показано сражение с одним из мини-боссов — Последним Мастером. Креативный директор студии Heart Machine Алкс Престон (Alx Preston) рассказал о происхождении этого опасного противника. Мастер была разрушительницей, как и персонаж игрока. Но она подверглась тлетворному влиянию местного мира и теперь бродит по нему, как проклятая нежить. Последний Мастер появляется в случайный момент, когда игроки активируют маяки на карте. В основном мини-босс сражается мечом, но в её арсенале также есть копьё и автоматический пистолет. Мастер такая же мобильная, как и персонажи игроков, — мини-босс может карабкаться, прыгать и перемещаться рывками. Релиз Hyper Light Breaker намечен на осень 2023-го. Игра будет доступна на ПК в раннем доступе через Steam. Заявлена поддержка русского языка",PC
256,Sony посвятит следующую State of Play миру и «боёвке» Final Fantasy XVI,Александр Кудрявцев,12 апреля ,"Компания Sony анонсировала дату проведения следующего шоу State of Play. Трансляция начнётся в 00:00 МСК в ночь с 13-го на 14 апреля. Эфир посвятят Final Fantasy XVI. Запись с анонсом шоу появилась в блоге PlayStation. Организаторы обещают подробнее рассказать о мире игры в жанре тёмного фэнтези и боевой системе новой «финалки». Трансляцию шоу можно будет посмотреть на официальных каналах PlayStation на Twitch и YouTube. Разработчики представят свыше 20 минут нового игрового процесса. Final Fantasy XVI выходит на PlayStation 5 в качестве временного эксклюзива 22 июня. Продюсер серии Наоки Ёсида (Naoki Yoshida) ранее говорил, что хотел бы увидеть игру на ПК. Но релиз на других платформах точно не стоит ждать в 2023 году. ",PlayStation 5
257,Diablo IV будет получать сюжетный контент каждые три месяца,Лина Скорич,12 апреля ,"Издание Game Informer посвятило свой новый выпуск Diablo IV. Журналисты не только подготовили материал по игре, но и вынесли творение Blizzard на обложку. Из текста можно узнать о разработке четвёртой части, её контентной поддержке и другом. Фрагменты из рассказанного девелоперы уже озвучивали в прошлом, поэтому ниже собрали свежие факты из публикации: Diablo IV выйдет 6 июня на ПК (Battle.net), PlayStation и Xbox. Оформившим предзаказ Deluxe- и Ultimate-изданий предоставят ранний доступ — cо 2 июня, 02:00 МСК. Также студия представила трейлер класса «Разбойник».","PC, PlayStation 5, PlayStation 4, Xbox Series X | S, Xbox One"
258,«Я эмоционально не готова» — Белла Рамзи о дальнейшей судьбе Джоэла в шоу The Last of Us,Лина Скорич,12 апреля ,"Если вы хоть что-то слышали о The Last of Us, до вас наверняка доходила информация о трагичной судьбе Джоэла в сиквеле. Авторы телеадаптации и ведущие актёры затронули эту тему в интервью Esquire. Шоураннеры Нил Дракманн (Neil Druckmann) и Крэйг Мэйзин (Craig Mazin) выстроили первый сезон довольно близко к первоисточнику. Если подход к написанию сценария не изменится, то в продолжении сериала зрителей может ждать крайне неприятный сюрприз. Педро Паскаль (Pedro Pascal), исполнивший роль Джоэла в шоу от HBO, не играл в The Last of Us и не видел ту самую сцену со своим персонажем, но он о ней знает. «Было бы странно отклоняться от оригинала, когда мы так точно следовали первой игре. Это мой честный ответ», — произнёс актёр «с озорным блеском в глазах». Белла Рамзи (Bella Ramsey), которая сыграла Элли в адаптации, относится к вопросу далеко не так спокойно, как коллега по съёмочной площадке. Она призналась, что ещё эмоционально не готова к тому, чтобы сериальный Джоэл в точности повторил судьбу своей игровой версии. Мэйзин в свою очередь подчеркнул, что не боится убивать персонажей. Но он также уточнил, что ни Дракманн, ни он сам не чувствуют себя ограниченными исходным материалом. Напомним, сериал по The Last of Us продлили на второй сезон всего через две с половиной недели после премьеры первого эпизода. Также в одном из интервью продюсеры намекнули на появление третьей главы, так как они могут не успеть раскрыть все события сиквела во втором сезоне.",Кино
259,В Steam исчезло упоминание русской локализации Starfield,Лина Скорич,12 апреля ,"Пользователи обратили внимание, что на странице Starfield в Steam из списка поддерживаемых языков исчез русский. Напомним, изначально планировался текстовый перевод игры на великий и могучий. Если опираться на информацию из базы данных SteamDB, упоминание русской локализации стёрли 11 апреля. Важно отметить, что плашка о переводе Starfield на русский держалась с самого появления страницы в магазине Valve. Пока что Bethesda не прокомментировала своё решение. Starfield увидит свет 6 сентября на ПК (Steam, Microsoft Store) и Xbox Series, включая Game Pass. 11 июня разработчики проведут Starfield Direct, во время которого расскажут больше подробностей об игре.",PC
260,Группа геймеров снова пытается остановить сделку Microsoft и ActiBlizz,Лина Скорич,12 апреля ,"Помните группу геймеров, которые воспротивились сделке между Microsoft и Activision Blizzard и попытались остановить её через суд? Сериал продолжается! После мартовской неудачи коллектив подал новый иск. Напомним, изначально пользователи обратились в высшую инстанцию в декабре 2022-го, а через три месяца судья отклонила жалобу. По её мнению, истцы не представили веские доказательства того, что сделка негативно повлияет на конкуренцию. У группы было двадцать дней, чтобы доработать иск и подать его заново. Так коллектив и поступил. Отредактированный документ теперь содержит семьдесят три страницы. По словам истцов, в него добавили информацию из внутренних бумаг Microsoft. Как следует из материала Reuters, Sony предоставила группе часть своих документов, чтобы дополнить иск. Например, имеются разделы с подробностями о десятилетнем соглашении по выпуску игр Activision на PlayStation, которое «майки» предложили Sony. В обновлённой жалобе юристы сравнивают договор, который Microsoft заключила с Nintendo в феврале, с тем, что был предложен Sony. Тем временем представители Microsoft не согласны с заявлением геймеров о том, что покупка Activision Blizzard является антиконкурентной. Также они отметили, что отредактированный иск содержит «неподтверждённые и неправдоподобные утверждения о влиянии сделки на конкуренцию». Напомним, регуляторы из разных государств всё ещё изучают сделку между Microsoft и Activision Blizzard. Среди них антимонопольщики США, Китая, Евросоюза и Великобритании. Последние, к слову, склоняются к одобрению покупки — итоговое решение озвучат уже 26 апреля.",Индустрия
261,Тираж Hot Wheels Unleashed перевалил за 2 миллиона копий,Андрей Маковеев,12 апреля ,"Hot Wheels Unleashed — гонки популярных машинок. Студия-разработчик Milestone и производитель игрушек Mattel объявили, что продажи Unleashed превысили 2 миллиона экземпляров. Компании поделились и другими цифрами: Луиза Биксио (Luisa Bixio), генеральный директор Milestone Напомним, Unleashed поддерживает одиночную игру, сплитскрин на двоих и онлайн-заезды до 12 участников. Также имеется подробный редактор трасс, где можно расставлять усилители, препятствия и другие элементы. Hot Wheels Unleashed примчалась на ПК (Steam, Epic Games Store), PlayStation, Xbox и Nintendo Switch.","PC, PlayStation 5, PlayStation 4, Xbox Series X | S, Xbox One, Nintendo Switch"
262,Анонс Trine 5: A Clockwork Conspiracy — самой масштабной игры в серии,Андрей Маковеев,12 апреля ,"Слух о скором анонсе Trine 5: A Clockwork Conspiracy подтвердился. Как и прошлые части франшизы, игру разрабатывает финская студия Frozenbyte. Издателем же выступает THQ Nordic. В главных ролях знакомая троица героев — рыцарь Понтий, маг Амадей и воровка Зоя. Им предстоит сразиться с грозной Механической армией, чтобы вернуть себе доброе имя и спасти близких. Судя по геймплейному трейлеру и скриншотам, Frozenbyte готовит традиционный платформер в духе предыдущих игр — не считая третьей, где команда ударилась в неудачные эксперименты с 3D. Если верить авторам, нас ждут: Trine 5: A Clockwork Conspiracy появится летом на ПК (Steam), PlayStation, Xbox и Nintendo Switch. Игру снабдят текстовым переводом на русский.","PC, PlayStation 5, PlayStation 4, Xbox Series X | S, Xbox One, Nintendo Switch"
